[
  {
    "id": "x-temoin-physique-chimie-001",
    "chapitre": "temoin-physique-chimie",
    "niveau": 1,
    "notions": [
      "n-temoin-physique-chimie-alpha"
    ],
    "capacites": [
      "bo-pc-temoin-01"
    ],
    "titre": "Exercice d'essai n° 1",
    "duree": 5,
    "calculatrice": false,
    "ordre": 10,
    "questions": [
      {
        "id": "q1",
        "label": "1.",
        "enonce": "Question d'essai à réponse vérifiable.",
        "reponse": {
          "type": "numerique",
          "valeur": 0.05,
          "toleranceRelative": 0.05,
          "unite": "\\mathrm{mol\\,L^{-1}}",
          "chiffresSignificatifs": 1
        },
        "solution": "Solution d'essai.",
        "indices": [
          "Indice d'essai n° 1.",
          "Indice d'essai n° 2."
        ],
        "revoir": "l-temoin-physique-chimie-001"
      }
    ]
  },
  {
    "id": "x-temoin-physique-chimie-002",
    "chapitre": "temoin-physique-chimie",
    "niveau": 1,
    "notions": [
      "n-temoin-physique-chimie-alpha"
    ],
    "capacites": [
      "bo-pc-temoin-01"
    ],
    "titre": "Exercice d'essai n° 2",
    "duree": 5,
    "calculatrice": false,
    "ordre": 20,
    "questions": [
      {
        "id": "q1",
        "label": "1.",
        "enonce": "Question d'essai à réponse vérifiable.",
        "reponse": {
          "type": "qcm",
          "choix": [
            "Choix d'essai A",
            "Choix d'essai B",
            "Choix d'essai C"
          ],
          "bonne": 2,
          "pourquoiFaux": [
            "Message d'essai pour le choix Choix d'essai A.",
            "Message d'essai pour le choix Choix d'essai B.",
            null
          ]
        },
        "solution": "Solution d'essai.",
        "indices": [
          "Indice d'essai n° 1.",
          "Indice d'essai n° 2."
        ],
        "revoir": "l-temoin-physique-chimie-001"
      }
    ]
  },
  {
    "id": "x-temoin-physique-chimie-003",
    "chapitre": "temoin-physique-chimie",
    "niveau": 1,
    "notions": [
      "n-temoin-physique-chimie-beta"
    ],
    "capacites": [
      "bo-pc-temoin-02"
    ],
    "titre": "Exercice d'essai n° 3",
    "duree": 5,
    "calculatrice": false,
    "ordre": 30,
    "questions": [
      {
        "id": "q1",
        "label": "1.",
        "enonce": "Question d'essai à réponse vérifiable.",
        "reponse": {
          "type": "ordre",
          "elements": [
            "Peser (essai)",
            "Dissoudre (essai)",
            "Compléter (essai)"
          ]
        },
        "solution": "Solution d'essai.",
        "indices": [
          "Indice d'essai n° 1.",
          "Indice d'essai n° 2."
        ],
        "revoir": "l-temoin-physique-chimie-008"
      }
    ]
  },
  {
    "id": "x-temoin-physique-chimie-004",
    "chapitre": "temoin-physique-chimie",
    "niveau": 1,
    "notions": [
      "n-temoin-physique-chimie-gamma"
    ],
    "capacites": [
      "bo-pc-temoin-04"
    ],
    "titre": "Exercice d'essai n° 4",
    "duree": 5,
    "calculatrice": false,
    "ordre": 40,
    "questions": [
      {
        "id": "q1",
        "label": "1.",
        "enonce": "Question d'essai à réponse vérifiable.",
        "reponse": {
          "type": "vrai-faux",
          "valeur": false,
          "justification": "Justification d'essai."
        },
        "solution": "Solution d'essai.",
        "indices": [
          "Indice d'essai n° 1.",
          "Indice d'essai n° 2."
        ],
        "revoir": "l-temoin-physique-chimie-014"
      }
    ]
  },
  {
    "id": "x-temoin-physique-chimie-005",
    "chapitre": "temoin-physique-chimie",
    "niveau": 2,
    "notions": [
      "n-temoin-physique-chimie-alpha"
    ],
    "capacites": [
      "bo-pc-temoin-01"
    ],
    "titre": "Exercice d'essai n° 5",
    "duree": 12,
    "calculatrice": true,
    "ordre": 50,
    "questions": [
      {
        "id": "q1",
        "label": "1.",
        "enonce": "Question d'essai 1.",
        "indices": [
          "Indice d'essai 1 : la piste.",
          "Indice d'essai 2 : la première étape faite.",
          "Indice d'essai 3 : presque la solution."
        ],
        "revoir": "l-temoin-physique-chimie-003",
        "solution": "Solution d'essai 1."
      },
      {
        "id": "q2",
        "label": "2.",
        "enonce": "Question d'essai 2.",
        "indices": [
          "Indice d'essai 1 : la piste.",
          "Indice d'essai 2 : la première étape faite.",
          "Indice d'essai 3 : presque la solution."
        ],
        "revoir": "l-temoin-physique-chimie-003",
        "solution": "Solution d'essai 2.",
        "reponse": {
          "type": "numerique",
          "valeur": 1.2,
          "toleranceRelative": 0.05,
          "unite": "\\mathrm{m\\,s^{-1}}",
          "chiffresSignificatifs": 2
        }
      }
    ],
    "preambule": "Données d'essai :\n\n| grandeur | valeur |\n|---|---|\n| $V$ | $0{,}100\\ \\mathrm{L}$ |"
  },
  {
    "id": "x-temoin-physique-chimie-006",
    "chapitre": "temoin-physique-chimie",
    "niveau": 2,
    "notions": [
      "n-temoin-physique-chimie-alpha"
    ],
    "capacites": [
      "bo-pc-temoin-01"
    ],
    "titre": "Exercice d'essai n° 6",
    "duree": 12,
    "calculatrice": true,
    "ordre": 60,
    "questions": [
      {
        "id": "q1",
        "label": "1.",
        "enonce": "Question d'essai 1.",
        "indices": [
          "Indice d'essai 1 : la piste.",
          "Indice d'essai 2 : la première étape faite.",
          "Indice d'essai 3 : presque la solution."
        ],
        "revoir": "l-temoin-physique-chimie-003",
        "solution": "Solution d'essai 1."
      },
      {
        "id": "q2",
        "label": "2.",
        "enonce": "Question d'essai 2.",
        "indices": [
          "Indice d'essai 1 : la piste.",
          "Indice d'essai 2 : la première étape faite.",
          "Indice d'essai 3 : presque la solution."
        ],
        "revoir": "l-temoin-physique-chimie-003",
        "solution": "Solution d'essai 2."
      }
    ]
  },
  {
    "id": "x-temoin-physique-chimie-007",
    "chapitre": "temoin-physique-chimie",
    "niveau": 2,
    "notions": [
      "n-temoin-physique-chimie-beta"
    ],
    "capacites": [
      "bo-pc-temoin-02"
    ],
    "titre": "Exercice d'essai n° 7",
    "duree": 12,
    "calculatrice": true,
    "ordre": 70,
    "questions": [
      {
        "id": "q1",
        "label": "1.",
        "enonce": "Question d'essai 1.",
        "indices": [
          "Indice d'essai 1 : la piste.",
          "Indice d'essai 2 : la première étape faite.",
          "Indice d'essai 3 : presque la solution."
        ],
        "revoir": "l-temoin-physique-chimie-009",
        "solution": "Solution d'essai 1."
      },
      {
        "id": "q2",
        "label": "2.",
        "enonce": "Question d'essai 2.",
        "indices": [
          "Indice d'essai 1 : la piste.",
          "Indice d'essai 2 : la première étape faite.",
          "Indice d'essai 3 : presque la solution."
        ],
        "revoir": "l-temoin-physique-chimie-009",
        "solution": "Solution d'essai 2."
      }
    ]
  },
  {
    "id": "x-temoin-physique-chimie-008",
    "chapitre": "temoin-physique-chimie",
    "niveau": 2,
    "notions": [
      "n-temoin-physique-chimie-gamma"
    ],
    "capacites": [
      "bo-pc-temoin-03",
      "bo-pc-temoin-04"
    ],
    "titre": "Exercice d'essai n° 8",
    "duree": 12,
    "calculatrice": true,
    "ordre": 80,
    "questions": [
      {
        "id": "q1",
        "label": "1.",
        "enonce": "Question d'essai 1.",
        "indices": [
          "Indice d'essai 1 : la piste.",
          "Indice d'essai 2 : la première étape faite.",
          "Indice d'essai 3 : presque la solution."
        ],
        "revoir": "l-temoin-physique-chimie-015",
        "solution": "Solution d'essai 1."
      },
      {
        "id": "q2",
        "label": "2.",
        "enonce": "Question d'essai 2.",
        "indices": [
          "Indice d'essai 1 : la piste.",
          "Indice d'essai 2 : la première étape faite.",
          "Indice d'essai 3 : presque la solution."
        ],
        "revoir": "l-temoin-physique-chimie-015",
        "solution": "Solution d'essai 2."
      }
    ],
    "code": {
      "langage": "python",
      "source": "for k in range(3):\n    print(k * 1.2)"
    }
  },
  {
    "id": "x-temoin-physique-chimie-009",
    "chapitre": "temoin-physique-chimie",
    "niveau": 3,
    "notions": [
      "n-temoin-physique-chimie-alpha",
      "n-temoin-physique-chimie-gamma"
    ],
    "capacites": [
      "bo-pc-temoin-01",
      "bo-pc-temoin-04"
    ],
    "titre": "Exercice d'essai n° 9",
    "duree": 25,
    "calculatrice": true,
    "ordre": 90,
    "questions": [
      {
        "id": "q1",
        "label": "1.",
        "enonce": "Question d'essai 1 (résolution de problème).",
        "indices": [
          "Indice d'essai 1 : la piste.",
          "Indice d'essai 2 : la première étape faite.",
          "Indice d'essai n° 3."
        ],
        "revoir": "l-temoin-physique-chimie-003",
        "solution": "Solution d'essai 1."
      },
      {
        "id": "q2",
        "label": "2.",
        "enonce": "Question d'essai 2 (résolution de problème).",
        "indices": [
          "Indice d'essai 1 : la piste.",
          "Indice d'essai 2 : la première étape faite.",
          "Indice d'essai n° 3."
        ],
        "revoir": "l-temoin-physique-chimie-003",
        "solution": "Solution d'essai 2."
      },
      {
        "id": "q3",
        "label": "3.",
        "enonce": "Question d'essai 3 (résolution de problème).",
        "indices": [
          "Indice d'essai 1 : la piste.",
          "Indice d'essai 2 : la première étape faite.",
          "Indice d'essai n° 3."
        ],
        "revoir": "l-temoin-physique-chimie-003",
        "solution": "Solution d'essai 3."
      }
    ]
  }
]
