[
  {
    "id": "x-temoin-methodes-maths-001",
    "chapitre": "temoin-methodes-maths",
    "niveau": 1,
    "notions": [
      "n-temoin-methodes-maths-logique"
    ],
    "capacites": [
      "bo-m-temoin-methodes-01"
    ],
    "titre": "Exercice transverse d'essai n° 1",
    "duree": 4,
    "calculatrice": false,
    "ordre": 10,
    "questions": [
      {
        "id": "q1",
        "label": "1.",
        "enonce": "Question d'essai.",
        "reponse": {
          "type": "vrai-faux",
          "valeur": true,
          "justification": "Justification d'essai."
        },
        "solution": "Solution d'essai.",
        "indices": [
          "Indice d'essai n° 1.",
          "Indice d'essai n° 2."
        ],
        "revoir": "l-temoin-methodes-maths-001"
      }
    ]
  },
  {
    "id": "x-temoin-methodes-maths-002",
    "chapitre": "temoin-methodes-maths",
    "niveau": 1,
    "notions": [
      "n-temoin-methodes-maths-python"
    ],
    "capacites": [
      "bo-m-temoin-methodes-02"
    ],
    "titre": "Exercice transverse d'essai n° 2",
    "duree": 4,
    "calculatrice": false,
    "ordre": 20,
    "questions": [
      {
        "id": "q1",
        "label": "1.",
        "enonce": "Question d'essai.",
        "reponse": {
          "type": "numerique",
          "valeur": 1024,
          "tolerance": 0
        },
        "solution": "Solution d'essai.",
        "indices": [
          "Indice d'essai n° 1.",
          "Indice d'essai n° 2."
        ],
        "revoir": "l-temoin-methodes-maths-011"
      }
    ]
  },
  {
    "id": "x-temoin-methodes-maths-003",
    "chapitre": "temoin-methodes-maths",
    "niveau": 1,
    "notions": [
      "n-temoin-methodes-maths-redaction"
    ],
    "capacites": [
      "bo-m-temoin-methodes-03"
    ],
    "titre": "Exercice transverse d'essai n° 3",
    "duree": 4,
    "calculatrice": false,
    "ordre": 30,
    "questions": [
      {
        "id": "q1",
        "label": "1.",
        "enonce": "Question d'essai.",
        "reponse": {
          "type": "ordre",
          "elements": [
            "Hypothèse (essai)",
            "Propriété (essai)",
            "Conclusion (essai)"
          ]
        },
        "solution": "Solution d'essai.",
        "indices": [
          "Indice d'essai n° 1.",
          "Indice d'essai n° 2."
        ],
        "revoir": "l-temoin-methodes-maths-021"
      }
    ]
  },
  {
    "id": "x-temoin-methodes-maths-004",
    "chapitre": "temoin-methodes-maths",
    "niveau": 2,
    "notions": [
      "n-temoin-methodes-maths-logique"
    ],
    "capacites": [
      "bo-m-temoin-methodes-01"
    ],
    "titre": "Exercice transverse d'essai n° 4",
    "duree": 8,
    "calculatrice": false,
    "ordre": 40,
    "questions": [
      {
        "id": "q1",
        "label": "1.",
        "enonce": "Question d'essai 1.",
        "indices": [
          "Indice d'essai 1 : la piste.",
          "Indice d'essai 2 : la première étape faite.",
          "Indice d'essai 3 : presque la solution."
        ],
        "revoir": "l-temoin-methodes-maths-002",
        "solution": "Solution d'essai 1."
      },
      {
        "id": "q2",
        "label": "2.",
        "enonce": "Question d'essai 2.",
        "indices": [
          "Indice d'essai 1 : la piste.",
          "Indice d'essai 2 : la première étape faite.",
          "Indice d'essai 3 : presque la solution."
        ],
        "revoir": "l-temoin-methodes-maths-002",
        "solution": "Solution d'essai 2."
      }
    ]
  },
  {
    "id": "x-temoin-methodes-maths-005",
    "chapitre": "temoin-methodes-maths",
    "niveau": 2,
    "notions": [
      "n-temoin-methodes-maths-python"
    ],
    "capacites": [
      "bo-m-temoin-methodes-02"
    ],
    "titre": "Exercice transverse d'essai n° 5",
    "duree": 8,
    "calculatrice": false,
    "ordre": 50,
    "questions": [
      {
        "id": "q1",
        "label": "1.",
        "enonce": "Question d'essai 1.",
        "indices": [
          "Indice d'essai 1 : la piste.",
          "Indice d'essai 2 : la première étape faite.",
          "Indice d'essai 3 : presque la solution."
        ],
        "revoir": "l-temoin-methodes-maths-012",
        "solution": "Solution d'essai 1."
      },
      {
        "id": "q2",
        "label": "2.",
        "enonce": "Question d'essai 2.",
        "indices": [
          "Indice d'essai 1 : la piste.",
          "Indice d'essai 2 : la première étape faite.",
          "Indice d'essai 3 : presque la solution."
        ],
        "revoir": "l-temoin-methodes-maths-012",
        "solution": "Solution d'essai 2."
      }
    ]
  },
  {
    "id": "x-temoin-methodes-maths-006",
    "chapitre": "temoin-methodes-maths",
    "niveau": 2,
    "notions": [
      "n-temoin-methodes-maths-redaction"
    ],
    "capacites": [
      "bo-m-temoin-methodes-03"
    ],
    "titre": "Exercice transverse d'essai n° 6",
    "duree": 8,
    "calculatrice": false,
    "ordre": 60,
    "questions": [
      {
        "id": "q1",
        "label": "1.",
        "enonce": "Question d'essai 1.",
        "indices": [
          "Indice d'essai 1 : la piste.",
          "Indice d'essai 2 : la première étape faite.",
          "Indice d'essai 3 : presque la solution."
        ],
        "revoir": "l-temoin-methodes-maths-022",
        "solution": "Solution d'essai 1."
      },
      {
        "id": "q2",
        "label": "2.",
        "enonce": "Question d'essai 2.",
        "indices": [
          "Indice d'essai 1 : la piste.",
          "Indice d'essai 2 : la première étape faite.",
          "Indice d'essai 3 : presque la solution."
        ],
        "revoir": "l-temoin-methodes-maths-022",
        "solution": "Solution d'essai 2."
      }
    ]
  }
]
